openscripttabsinsamewindow,Open linked scripts as tabs in same window,Open linked scripts as tabs in same window,,Open script tabs in the same window
focuspantexteditor,Pan text editor into view on focus,Pan text editor into view on focus,,auto pan text editor on focus
texteditor_defaultwidth,Default code window width,Default code window width,,default code window width
texteditor_defaultheight,Default code window height,Default code window height,,default code window height
texteditor_minwidth,Minimum code window width,Minimum code window width,,min code window width
texteditor_minheight,Minimum code window height,Minimum code window height,,min code window height
webserverport,The port number to use for the help web server,The port number to use for the help web server,,The port number to use for the help web server setting
externalbrowserforhelp,Use an external browser for help,Use an external browser for help,,Use an external browser for help setting
imageeditor_buttonchoiceonframedelete,Default for deleting frames,Default for deleting frames,,Automatic button choice on frame deletion setting
imageeditor_choicefortoolchanges,Default for committing changes on tool change,Default for committing changes on tool change,,Choice for tool changes setting
imageeditor_layerlockeddisplay,Dismiss layer is locked warning,Dismiss layer is locked warning,,Layer locked display setting
imageeditor_groupselecteddialog,Dismiss group selected warning,Dismiss group selected warning,,Group selected dialog setting
imageeditor_createFromStripConfirm,Default for replacing images during strip import,Default for replacing images during strip import,,create from strip confirm dialog setting
imageeditor_drawthinselection,Draw thin selection outline,Draw thin selection outline,,Draw Thin selection setting
imageeditor_selectioncolour1,Selection outline colour 1,Selection outline colour 1,,Selection colour 1
imageeditor_selectioncolour2,Selection outline colour 2,Selection outline colour 2,,Selection colour 2
imageeditor_backgroundcolour,Background colour in editor,Background colour in editor,,Background colour in image editor
imageeditor_transparentbackgroundstyle,Transparent background style,Transparent background style,,Transparent background style in image editor
imageeditor_transparentcolour1,Transparent background colour 1,Transparent background colour 1,,Transparent background colour 1 in image editor
imageeditor_transparentcolour2,Transparent background colour 2 (block pattern style),Transparent background colour 2 (block pattern style),,Transparent background colour 2 in image editor
imageeditor_transparentblocksize,Transparent background block size (block pattern style),Transparent background block size (block pattern style),,Transparent block size in image editor
imageeditor_gridsettings,Grid Settings,Configuración de cuadrícula,,grid settings pref
imageeditor_defaultloopmode,Default loop mode,Default loop mode,,image editor setting Default playback loop mode
gridsettings_displaygrid,Display Grid,Mostrar cuadrícula,,GridSettings.DisplayGrid pref
gridsettings_snaptogrid,Snap to Grid,Ajustar a cuadrícula,,GridSettings.SnapToGrid pref
gridsettings_xspacing,Horizontal pixel spacing,Horizontal pixel spacing,,GridSettings.XSpacing pref
gridsettings_yspacing,Vertical pixel spacing,Vertical pixel spacing,,GridSettings.YSpacing pref
gridsettings_colour,Line Colour,Line Colour,,GridSettings.Colour pref
arctool_colourofknots,Colour of Knots,Colour of Knots,,Colour of Knots in Arc Tool
arctool_colourofcontrolpoints,Colour of Control Points,Colour of Control Points,,Colour of Control Points in Arc Tool
arctool_colourofcontrollines,Colour of Control Lines,Colour of Control Lines,,Colour of Control Lines in Arc Tool
arctool_colourofselectedpoints,Colour of Selected Points,Colour of Selected Points,,Colour of Selected Points in Arc Tool
arctool_sizeofpoints,Size of Points,Size of Points,,Size of Points in Arc Tool
objecteditor_buttonchoiceondeletion,Default for deleting event,Default for deleting event,,Automatic button choice on event deletion in Object Editor
patheditor_linecolour,The colour applied to the path,The colour applied to the path,,Line Colour in Path Editor
patheditor_lineerrorcolour,The colour applied to an invalid path,The colour applied to an invalid path,,Line Error Colour in Path Editor
patheditor_anchorerrorcolour,The colour applied to an invalid anchor,The colour applied to an invalid anchor,,anchor Error Colour in Path Editor
patheditor_linehighlight,The colour applied to highlighted path segments,The colour applied to highlighted path segments,,Line Highlight in Path Editor
patheditor_anchorcolour,The colour applied to anchor points,The colour applied to anchor points,,Anchor colour in Path Editor
patheditor_anchorhighlight,The colour applied to highlighted anchor points,The colour applied to highlighted anchor points,,Anchor highlight colour in Path Editor
patheditor_anchorerrorhighlight,The colour applied to invalid highlighted anchor points,The colour applied to invalid highlighted anchor points,,Anchor error highlight colour in Path Editor
patheditor_anchoractive,The colour applied to active anchor points,The colour applied to active anchor points,,Active Anchor colour in Path Editor
patheditor_anchorerroractive,The colour applied to active invalid anchor points,The colour applied to active invalid anchor points,,error Active Anchor colour in Path Editor
patheditor_insertionprecision,The precision (in pixels) needed to insert a point on a path segment,The precision (in pixels) needed to insert a point on a path segment,,Insertion Precision in Path Editor
patheditor_rotatesensitivity,The path rotation sensitivity,The path rotation sensitivity,,Rotation sensitivity in Path Editor
patheditor_scalesensitivity,The path scale sensitivity,The path scale sensitivity,,Scale Sensitivity in Path Editor
patheditor_anchorwidth,The width of the anchor points,The width of the anchor points,,Anchor width in Path Editor
patheditor_anchorheight,The height of the anchor points,The height of the anchor points,,Anchor Height in Path Editor
patheditor_maskoverlay,Enable mask overlay for point insertion,Enable mask overlay for point insertion,,Mask Overlay in Path Editor
patheditor_maskcolour,The colour applied to the mask overlay,The colour applied to the mask overlay,,Mask colour in Path editor
resourcetree_automaticdeletion,Default for resource deletion,Default for resource deletion,,Automatic deletion on resource tree
resourcetree_automaticopenall,Default for opening multiple resources,Default for opening multiple resources,,Automatic button choice on opening multiple resources
resourcetree_maxresourcesbeforewarning,Maximum number of resources to open simultaneously before warning,Maximum number of resources to open simultaneously before warning,,Max resources to open before showing a warning
roomeditor_automaticparentitemdeletion,Default for parent room item deletion,Default for parent room item deletion,,Automatic parent item deletion in room editor
roomeditor_automaticparentlayerdeletion,Default for parent room layer deletion,Default for parent room layer deletion,,Automatic parent layer deletion in room editor
roomeditor_automaticitemdeletion,Default for room item deletion,Default for room item deletion,,Automatic item deletion in room editor
roomeditor_automaticlayerdeltion,Default for room layer deletion,Default for room layer deletion,,Automatic layer deletion in room editor
roomeditor_automaticacceptitemdrag,Dismiss invalid resource dragged into room error,Dismiss invalid resource dragged into room error,,Automatic drag acceptance on invalid items in room editor
roomeditor_automaticacceptlayerdrag,Dismiss dragging resources with multiple or no selected layers error,Dismiss dragging resources with multiple or no selected layers error,,Automatic layer drag acceptance in room editor
roomeditor_automaticacceptlockedinvisiblelayerdrag,Dismiss dragging resources into a locked or invisible layer error,Dismiss dragging resources into a locked or invisible layer error,,Automatic layer drag acceptance for locked or invisible layer in room editor
roomeditor_linkcolour,The link colour for floating chains in the room editor,The link colour for floating chains in the room editor,,Link Colour in Room Editor
roomeditor_chainalphafalloff,The distance in pixels that the chain alpha begins to fade out,The distance in pixels that the chain alpha begins to fade out,,Alpha Fall Off of chain in Room Editor
roomeditor_chainalphadistance,The distance in pixels that the chain alpha stops fading out,The distance in pixels that the chain alpha stops fading out,,Distance of chain alpha fall off in Room Editor
roomeditor_minfalloffalpha,The chain link alpha at the the falloff stop distance,The chain link alpha at the the falloff stop distance,,Minimum Alpha fall off in Room Editor
roomeditor_multiselectcolour,The highight colour for the current shift multi select area,The highight colour for the current shift multi select area,,Colour of the multi select area in Room Editor
roomeditor_tileselectcolour,The highight colour for selected tiles in the tile editor,The highight colour for selected tiles in the tile editor,,Tile Select colour in Room Editor
roomeditor_tilehighlightcolour,The highight colour for mouse over tiles in the tile editor,The highight colour for mouse over tiles in the tile editor,,Tile Highlight Colour in Room Editor
roomeditor_tileinheritcolour,The highight colour for inherited tiles in the tile editor,The highight colour for inherited tiles in the tile editor,,Tile Inherit colour in Room Editor
roomeditor_showviews,The initial setting for the show views button on opening a room,The initial setting for the show views button on opening a room,,Show Views in Room Editor
timeline_noundoactions,Show a warning dialog on actions that can't be undone,Show a warning dialog on actions that can't be undone,,No Undo Actions in Timeline Editor
timeline_opennewmoments,Open new moments for editing immediately,Open new moments for editing immediately,,Open newly created moments for editing preference
CMenu_CloseAllButThis,Close All But This,Close All But This,,Close all but this context menu
codeeditor_textcolour,Colour of text,Colour of text,,Text Colour in Code Editor
codeeditor_font,Font to use,Fuente a usar,,Font to use in Code Editor
codeeditor_fontstyle,Font Style,Estilo de fuente,,Font Style to use in Code Editor
codeeditor_fontaa,Font AA,Fuente AA,,Anti-Alias Font in Code Editor
codeeditor_textsize,Size of text,Tamaño del texto,,Size of Text in Code Editor
codeeditor_normaltext,Normal Text,Texto normal,,Colour of Normal Text in Code Editor
codeeditor_keywords,Keywords,Palabras clave,,Colour of Keywords in Code Editor
codeeditor_values,Values,Valores,,Colour of Values in Code Editor
codeeditor_strings,Strings,Cadenas,,Colour of Strings in Code Editor
codeeditor_comments,Comments,Comentarios,,Colour of Comments in Code Editor
codeeditor_constants,Constants,Constantes,,Colour of Constants in Code Editor
codeeditor_builtinvariables,Built-in Variables,Built-in Variables,,Colour of Built-in Variables in Code Editor
codeeditor_builtinfunctions,Built-in Functions,Built-in Functions,,Colour of Built-in Functions in Code Editor
codeeditor_scriptnames,Script names,Nombres de escrituras,,Colour of Script names in Code Editor
codeeditor_resourcenames,Resource names,Nombre de recursos,,Colour of Resource names in Code Editor
codeeditor_linenumbers,Line numbers,Números de línea,,Colour of Line Numbers in Code Editor
codeeditor_readonlylines,Read only line style,Read only line style,,Style of read only lines in Code Editor
codeeditor_bookmarklines,Bookmark line style,Bookmark line style,,Style of bookmark lines in Code Editor
codeeditor_selectedline,Selected line,Línea seleccionada,,Selected line colour in Code Editor
codeeditor_changedline,Changed line,Línea cambiada,,Changed line colour in Code Editor
codeeditor_backgroundcolour,Background colour,Color de fondo,,Colour of Background in Code Editor
codeeditor_selection,Selection Colour,Color de selección,,Colour of Selections in Code Editor
codeeditor_currentline,Current line colour,Color de línea actual,,Colour of current line in Code Editor
codeeditor_errorline,Error line colour,Color de línea de error,,Colour of Error line in Code Editor
codeeditor_highlight,Highlight colour,Color de realce,,Colour of higlighted text in code editor
codeeditor_debugger,Debugger colour,Debugger colour,,Colour of line the debugger is on
codeeditor_bracketmatchsuccess,Colour of successful bracket/quote matches.,Colour of successful bracket/quote matches.,,Colour of Successful bracket matches in code editor
codeeditor_bracketmatchfail,Colour of failed bracket/quote matches.,Colour of failed bracket/quote matches.,,Colour of failed bracket matches in code editor
codeeditor_statusbarselected,The colour of the inteliesense text up to the current point,The colour of the inteliesense text up to the current point,,Status Bar selection colour in code editor
codeeditor_intellisenseleft,The colour of the intellisense text left,The colour of the intellisense text left,,Colour of intellisense left in Code Editor
codeeditor_whitespacestyle,White space text style,White space text style,,White space style in Code Editor
codeeditor_keeptabs,Keep Tabs,Keep Tabs,,Keep Tabs in Code Editor
codeeditor_tabsize,Tab Size,Tab Size,,Tab Size in Code Editor
codeeditor_showwhitespace,Show Whitespace,Show Whitespace,,Show Whitespace in Code Editor
codeeditor_showlinenumbers,Show Line Numbers,Show Line Numbers,,Show Line Numbers in Code Editor
codeeditor_showtablines,Show Tab Lines,Show Tab Lines,,Show Tab Lines in Code Editor
codeeditor_colourcoding,Enable Colour Coding,Enable Colour Coding,,Enable Colour Coding in Code Editor
codeeditor_maxlinecount,Document line limit (<=0 no limit),Document line limit (<=0 no limit),,Max Line Count in Code Editor
codeeditor_matchindent,Match indent on new lines,Match indent on new lines,,Match indent in code editor
codeeditor_codecompletion,Enable Code Completion,Enable Code Completion,,Enable Code Completion in Code editor
codeeditor_enablebrackets,Enable adding brackets to functions,Enable adding brackets to functions,,Enable adding brackets to functions in Code editor
codeeditor_contextmenu,Enable Context Menu,Enable Context Menu,,Enable Context Menu in Code Editor
codeeditor_columnselect,Allow column selection,Allow column selection,,Allow column selection in Code Editor
codeeditor_breakpoints,Allow breakpoints,Allow breakpoints,,Allow breakpoints in Code Editor
codeeditor_blockcomment,Allow Block Comments,Allow Block Comments,,Allow Block Comments in Code Editor
codeeditor_undostacksize,Undo/Redo stack limit (<0 unlimited),Deshacer/Rehacer límite de pila (<0 ilimitado,,Undo Stack Size in Code Editor
codeeditor_highlightmatches,Highlight words which match selection,Highlight words which match selection,,Highlight words which match selection in Code Editor
codeeditor_textcolours,Text colours and style,Colores y estilos de texto,,Text colours and style in Code Editor
codeeditor_options,Options,Opciones,,Options for Code Editor
codeeditor_show_obsoletes,Colour coding/code completion for obsolete content,Colour coding/code completion for obsolete content,,code editor show obsolete symbols pref
codeeditor_highlight_pairs,Highlight symbol pairs,Highlight symbol pairs,,code editor highlight matching symbol pairs pref
codeeditor_obsolete_style,Obsolete functions etc,Obsolete functions etc,,code editor text style for obsolete symbols
codeeditor_braces,Braces,Braces,,code editor text style for braces
codeeditor_folded_region,Folded #region,Folded #region,,text style for folded #region
codeeditor_folded_region_tag,Folded region name,Folded region name,,text style for folded region tag
dialogeditor_textcolours,Text colours and style,Colores y estilos de texto,,Text colours and style in Dialog Editor
dialogeditor_options,Options,Opciones,,Options in Dialog Editor
sourcecontrolgit_username,Username to commit as,Username to commit as,,Username to commit as for source control git
sourcecontrolgit_password,Password for Username,Password for Username,,Password for Username to commit as for source control git
sourcecontrolgit_email,Email to commit as,Email to commit as,,Email for user to commit as for source control git
sourcecontrolgit_mergetoolpath,Path to Tool,Path to Tool,,Path to Tool for source control git
sourcecontrolgit_mergetooloptions,Options for Tool,Options for Tool,,Options for Tool for Source Control Git
sourcecontrolgit_logging_verbose,Verbose Logging,Verbose Logging,,Verbose Logging for Source Control Git
sourcecontrolgit_externaltoolerror,Source Control (Git) External Tool Error,Source Control (Git) External Tool Error,,Source Control (Git) External Tool Error message title
sourcecontrolgit_nomergetool,Merge Tool path is invalid,Merge Tool path is invalid,,Merge Tool path is invalid
sourcecontrolgit_nodifftool,Diff Tool path is invalid,Diff Tool path is invalid,,Diff Tool path is invalid
sourcecontrolgit_automatically_start,Automatically enable Source Control,Automatically enable Source Control,,Automatically enable Source Control
ProgressBar_checking_device,Checking Device...,Checking Device...,,Checking Device Connection Progress Bar Label
ProgressBar_detecting_devices,Detecting Devices...,Detecting Devices...,,Detecting Devices Progress Bar label
ProgressBar_runtime_delete,Deleting Runtime...,Deleting Runtime...,,Deleting Runtime Progress Bar Label
ProgressBar_sourcecontrolgit_push,Pushing...,Pushing...,,Push progress label
ProgressBar_sourcecontrolgit_pull,Pulling...,Pulling...,,Pull progress label
ProgressBar_sourcecontrolgit_checkout,Checking Out...,Checking Out...,,Checkout progress label
ProgressBar_sourcecontrolgit_revert_files,Reverting Files...,Reverting Files...,,Revert Files progress label
ProgressBar_sourcecontrolgit_revert_revision,Reverting Revision...,Reverting Revision...,,Revert Revision progress label
ProgressBar_sourcecontrolgit_clone,Cloning...,Clonando...,,Clone progress label
desktop_slowclicktime,Slow double-click time in milliseconds,Slow double-click time in milliseconds,,Slow double-click time in milliseconds
desktop_scrolllocktime,The time in milliseconds to lock scrolling to a gadget,The time in milliseconds to lock scrolling to a gadget,,The time in milliseconds to lock scrolling to the gadget scrolling started on as long as the mouse is still over it
desktop_acpowerspeed,% when on AC Power,% when on AC Power,,Speed of IDE while running on AC power
desktop_batterypowerspeed,% when on Battery Power,% when on Battery Power,,Speed of IDE while running on battery power
desktop_focuspowerspeed,% when application is not in focus,% when application is not in focus,,% when application is not in focus
desktop_scrollspeed,Scrolling speed,Scrolling speed,,scroll speed preference
folderwatcher_frequency,File watcher frequency in milliseconds,File watcher frequency in milliseconds,,File watcher frequency in milliseconds
folderwatcher_laptopfrequency,File watcher frequency in milliseconds on laptops,File watcher frequency in milliseconds on laptops,,File watcher frequency in milliseconds on laptops
ggs_enable_steam,Enable Steam,Enable Steam,,Enable Steam
ggs_steam_id,Steam Id,Steam Id,,Steam Id
ggs_enable_iap_sandbox,Enable IAP Sandbox,Enable IAP Sandbox,,Enable IAP Sandbox
ggs_tile_type,Type of Tiles to display,Type of Tiles to display,,Type of Tiles to display
ggs_tiles_flip,Flip tiles,Flip tiles,,Flip tiles
ggs_tiles_iconic,Iconic tiles,Iconic tiles,,Iconic tiles
ggs_tiles_cycle,Cycle tiles, Cycle tiles,,Cycle tiles
ggs_new_guid,Create New GUID,Create New GUID,,Create New GUID
ggs_short_circuit_evaluations,Enable Short Circuit Evaluations,Enable Short Circuit Evaluations,,Enable Short Circuit Evaluations
ggs_delete_event_on_room_change,Delete Event on Room Changes,Delete Event on Room Changes,,Delete Event on Room Changes
ggs_use_fast_collisions,Enable Fast Collisions,Enable Fast Collisions,,Enable Fast Collisions
ggs_game_speed,Game Frames Per Second,Game Frames Per Second,,Game Frames Per Second
ggs_game_identifier,Game Identifier,Game Identifier,,Game Identifier
ggs_game_guid,Game GUID,Game GUID,,Game GUID
ggs_isdnd,Use DnD™ as default code choice,Use DnD™ as default code choice,,Project code type
ggs_mips_for_3d_textures,Generate mipmaps for separate texture pages,Generate mipmaps for separate texture pages,,Generate mipmaps for separate texture pages
TargetSelection_RequiresWorker,Requires Worker,Requires Worker,,label for when a selected platform requires a worker
TargetSelection_Worker,Worker:,Worker:,,the list title for target selecting worker
TargetSelection_Platform,Platform:,Platform:,,the list title for target selecting platform
TargetSelection_Config,Config:,Config:,,the list title for target selecting config
TargetSelection_Device,Device:,Device:,,the list title for target selecting device
TargetSelection_Runtime,Output:,Output:,,the list title for target selecting runtime
TargetSelection_Platform_Test,Test,Test,,the teset platform title in the platform selection list
TargetSelection_Platform_Windows,Windows,Windows,,the windows platform title in the platform selection list
TargetSelection_Platform_windowsuap,Windows UWP,Windows UWP,,the windows uwp platform title in the platform selection list
TargetSelection_Platform_WinPhone8,Windows Phone 8,Windows Phone 8,,the windows phone platform title in the platform selection list
TargetSelection_Platform_Mac,macOS,macOS,,the mac platform title in the platform selection list
TargetSelection_Platform_Linux,Ubuntu,Ubuntu,,the linux platform title in the platform selection list
TargetSelection_Platform_HTML5,HTML5,HTML5,,the html5 platform title in the platform selection list
TargetSelection_Platform_android,Android,Android,,the android platform title in the platform selection list
TargetSelection_Platform_AmazonFire,Amazon Fire,Amazon Fire,,the Amazon Fire platform title in the platform selection list
TargetSelection_Platform_ios,iOS,iOS,,the apple iOS platform title in the platform selection list
TargetSelection_Platform_AppleTV,tvOS,tvOS,,the apple tvOS platform title in the platform selection list
TargetSelection_Platform_ps3,PlayStation 3,PlayStation 3,,the ps3 platform title in the platform selection list
TargetSelection_Platform_ps4,PlayStation 4,PlayStation 4,,the ps4 platform title in the platform selection list
TargetSelection_Platform_psvita,PlayStation Vita,PlayStation Vita,,the ps vita platform title in the platform selection list
TargetSelection_Platform_xboxone,Xbox One,Xbox One,,the xbox one platform title in the platform selection list
TargetSelection_Runtime_VM,VM,VM,, the vm title in the runtime selection list
TargetSelection_Runtime_YYC,YYC,YYC,, the yyc title in the runtime selection list
TargetSelection_Runtime_Javascript,JavaScript,JavaScript,, the javascript title in the runtime selection list
TargetSelection_Device_Local,Local,Local,, the local device title in the device selection list
TargetSelection_Device_Default,Default,Predeterminado,, the default device title in the device selection list
TargetSelection_Device_Device,Device,Dispositivo,, the 'device' device title in the device selection list
TargetSelection_Device_Simulator,Simulator,Simulador,, the simulator device title in the device selection list
TargetSelection_Device_Simulator_iPad2,Simulator - iPad 2,Simulador - iPad 2,, the simulator device title in the device selection list
TargetSelection_Device_Simulator_iPadAir,Simulator - iPad Air,Simulador - iPad Air,, the simulator device title in the device selection list
TargetSelection_Device_Simulator_iPadAir2,Simulator - iPad Air 2,Simulador - iPad Air 2,, the simulator device title in the device selection list
TargetSelection_Device_Simulator_iPadPro,Simulator - iPad Pro,Simulador - iPad Pro,, the simulator device title in the device selection list
TargetSelection_Device_Simulator_iPadRetina,Simulator - iPad Retina,Simulador - iPad Retina,, the simulator device title in the device selection list
TargetSelection_Device_Simulator_iPhone4S,Simulator - iPhone 4S,Simulador - iPhone 4S,, the simulator device title in the device selection list
TargetSelection_Device_Simulator_iPhone5,Simulator - iPhone 5,Simulador - iPhone 5,, the simulator device title in the device selection list
TargetSelection_Device_Simulator_iPhone5S,Simulator - iPhone 5S,Simulador - iPhone 5S,, the simulator device title in the device selection list
TargetSelection_Device_Simulator_iPhone6,Simulator - iPhone 6,Simulador - iPhone 6,, the simulator device title in the device selection list
TargetSelection_Device_Simulator_iPhone6Plus,Simulator - iPhone 6 Plus,Simulador - iPhone 6 Plus,, the simulator device title in the device selection list
TargetSelection_Device_Simulator_iPhone6S,Simulator - iPhone 6,Simulador - iPhone 6,, the simulator device title in the device selection list
TargetSelection_Device_Simulator_iPhone6SPlus,Simulator - iPhone 6 Plus,Simulador - iPhone 6 Plus,, the simulator device title in the device selection list
TargetSelection_Device_Editor,Device Editor,Editor de dispositivo,,the device editor window title
TargetSelection_Device_Editor_Tooltop,Open Device Editor,Abrir editor de dispositivo,,the device editor button tooltip
TargetSelection_Device_Editor_Cancel,This will lose any unapplied changes you have made - do you want to continue?,This will lose any unapplied changes you have made - do you want to continue?,,Cancelling the device manager does this
DnDModule_ToolboxWindow,Toolbox,Herramientas,,The Drag and Drop™ toolbox when in a standalone window
DnDModule_CodeOutputWindow,Equivalent Code,Código equivalente,,The Drag and Drop™ equivalent code window for nodes
DnDModule_Toolbox_Title,Toolbox,Herramientas,,The toolbox title when docked
