Marketplace_Updating,Updating...,Updating...,,marketplace updating label
Marketplace_WindowTitle,Marketplace,Marketplace,,Marketplace webview window title
Marketplace_PurchaseHistory,My Purchase History,Mi historial de compras,,Marketplace purchase history menu entry
Marketplace_NoPublisherTitle,Publisher Account Required,Publisher Account Required,,marketplace no publisher title
Marketplace_NoPublisherMessage,You do not have a Publisher attached to this account. Do you want to add one now?,You do not have a Publisher attached to this account. Do you want to add one now?,,marketplace no publisher account message
Marketplace_ProjectRequiredDialogTitle,Project Required,Project Required,,marketplace import project required dialog title
Marketplace_ProjectRequiredDialogMessage,An open project is required to import assets.\nDo you want to create a new project or open an existing project now?,An open project is required to import assets.\nDo you want to create a new project or open an existing project now?,,marketplace import project required dialog message
MPackage_PackageUploadTitle,Package Upload,Package Upload,,package upload dialog title
MPackage_PackageCreated,Created package '{0}' version {1},Created package '{0}' version {1},,package create success message
MPackage_PackageUploading,Uploading to Marketplace...,Uploading to Marketplace...,,package uploading message
MPackage_PackageIDInvalid,Package ID is invalid,Package ID is invalid,,mplace create package package id error
MPackage_AssetDisplayName,Display name,Display name,,marketplace asset display name label
MPackage_DisplayNameInvalid,Display name is invalid,Display name is invalid,,marketplace package display name error
MPackage_DisplayNameRestrictions,Display name restrictions,Display name restrictions,,package display name restrictions label
MPackage_DisplayNameRule1,- Must be between 5 and 30 characters long,- Must be between 5 and 30 characters long,,asset create restriction label
MPackage_DisplayNameRule2,#¿NOMBRE?,#¿NOMBRE?,,asset create restriction label
MPackage_DisplayNameRule3,#¿NOMBRE?,#¿NOMBRE?,,asset create restriction label
MPackage_PackageIdRestrictions,Package ID Restrictions,Package ID Restrictions,,asset create restriction label
MPackage_PackageIdRule1,#¿NOMBRE?,#¿NOMBRE?,,asset create restriction label
MPackage_PackageIdRule2,#¿NOMBRE?,#¿NOMBRE?,,asset create restriction label
MPackage_PackageIdRule3,#¿NOMBRE?,#¿NOMBRE?,,asset create restriction label
MPackage_NewPackageInfo_Other,IMPORTANT: The package ID cannot be changed once your asset has been created.,IMPORTANT: The package ID cannot be changed once your asset has been created.,,create asset warning label
MPackage_UploadedMessage,Uploaded package '{0}' version {1}\nGo to the asset listing page?,Uploaded package '{0}' version {1}\nGo to the asset listing page?,,mplace package uploaded message
MPackage_UploadFailed,Package upload failed: {0},Package upload failed: {0},,mplace package upload failed message
MPackage_UploadCancelled,Package upload cancelled,Package upload cancelled,,mplace package upload cancelled message
MPackage_PackageType,Package Type:,Package Type:,,mplace package type label
MPackage_CategorySetting_Demo,IMPORTANT: The asset category will be set to 'Demos' on upload,IMPORTANT: The asset category will be set to 'Demo' on upload,,mplace category setting message
MPackage_CategorySetting_Tutorial,IMPORTANT: The asset category will be set to 'Tutorials' on upload,IMPORTANT: The asset category will be set to 'Tutorial' on upload,,mplace category setting message
MPackage_NewPackageInfo_Demo,IMPORTANT: The package ID cannot be changed once your asset has been created. The asset category will be set to 'Demos' on upload,IMPORTANT: The package ID cannot be changed once your asset has been created. The asset category will be set to 'Demo' on upload,,mplace category setting message
MPackage_NewPackageInfo_Tutorial,IMPORTANT: The package ID cannot be changed once your asset has been created. The asset category will be set to 'Tutorials' on upload,IMPORTANT: The package ID cannot be changed once your asset has been created. The asset category will be set to 'Tutorial' on upload,,mplace category setting message
MenuBar_AddMenuBarEntry,Add Menu Bar Entry,Add Menu Bar Entry,,Add a new menu bar entry at the end of the bar
MenuBar_AddMenuBarEntryAfter,Add Menu Bar Entry After '{0}',Add Menu Bar Entry After '{0}',,Add a new menu bar entry after the selected entry
MenuBar_AddMenuBarEntryBefore,Add Menu Bar Entry Before '{0}',Add Menu Bar Entry Before '{0}',,Add a new menu bar entry before the selected entry
MenuBar_Edit,Edit,Editar,,Menu bar heading: Edit
MenuBar_File,File,Archivo,,Menu bar heading: File
MenuBar_Image,Image,Imagen,,menu bar heading: Image
MenuBar_Language,Language,Idioma,,Menu bar heading for languages
MenuBar_Style,Style,Estilo,,The menu bar heading for style
MenuBar_Tools,Tools,Herramientas,,Menu bar heading: Tools
MenuBar_View,View,View,,Menu bar heading: View
Navigation_Back,Back,Back,,Back
Navigation_Forward,Forward,Forward,,Forward
Navigation_Reload,Reload,Reload,,Reload webpage
News_ReleaseNotes,Release Notes,Release Notes,,Release notes window caption
Object_Mask,Collision Mask:,Máscara de colisión:,,"object ""mask"" property"
Object_Parent,Parent,Padre,,"object ""parent"" property"
ObjectEditor_ParentChildren,Parent & Children,Padre & Hijo,,Object editor parent and children caption
Object_Persistent,Persistent,Persistente,,"Object Model ""persistent"" property"
Object_PhysicsAngularDamping,Angular Damping,Angular Damping,,"object ""physicsAngularDamping"" property label"
Object_PhysicsDensity,Density,Density,,"object ""physicsDensity"" property label"
Object_PhysicsFriction,Friction,Friction,,"object ""physicsFriction"" property label"
Object_PhysicsGroup,Collision Group,Collision Group,,"object ""physicsGroup"" property label"
Object_PhysicsKinematic,Kinematic,Kinematic,,"object ""physicsKinematic"" property label"
Object_PhysicsLinearDamping,Linear Damping,Linear Damping,,"object ""physicsLinearDamping"" property label"
Object_PhysicsRestitution,Restitution,Restitution,,"object ""physicsRestitution"" property label"
Object_PhysicsSensor,Sensor,Sensor,,"object ""physicsSensor"" property label"
Object_PhysicsStartAwake,Start Awake,Start Awake,,"object ""physicsStartAwake"" property label"
Object_Solid,Solid,Solido,,"Object Model ""solid"" property"
Object_UsesPhysics,Uses Physics,Usa física,,"Object Model ""uses physics"" property"
Object_Visible,Visible,Visible,,"Object Model ""visible"" property"
ObjectEdior_PhysicsShape_ZoomIn,Zoom in,Acercar,,Object editor physics window label
ObjectEdior_PhysicsShape_ZoomOut,Zoom out,Alejar,,Object editor physics window label
ObjectEdior_PhysicsShape_ZoomReset,Reset zoom,Reset zoom,,Object editor physics window label
ObjectEditor_AddEvent,Add Event,Añadir Evento,,Object editor add event
ObjectEditor_Sprite,Sprite,Sprite,,Object editor sprite group
ObjectEditor_AnimSpeed,Animation Speed,Velocidad de animiación,,Physics collision window playback speed
ObjectEditor_Arg0,{0},{0},,"empty string, single unlocalised argument"
ObjectEditor_Box,Box,Caja,,Object editor collision shape box
ObjectEditor_ChangeEvent,Change Event,Canviar evento,,Object editor change event menu option
ObjectEditor_ChangeEventExistsTitle,Cannot change event,No se puede cambiar el evento,,Object Editor tried to change an event to one that already exists
ObjectEditor_ChangeEventExistsMessage,The Event cannot be changed to an existing Event.,The Event cannot be changed to an existing Event.,,Object Editor tried to change an event to one that already exists
ObjectEditor_ConvertEventType,Convert to {0},Convertir a {0},,Change the event from DnD™ to script or from script to DnD™
ObjectEditor_EventTypeScript,GML,GML,,Event type when script
ObjectEditor_EventTypeDnD,DnD™,DnD™,,Event type when DnD™
ObjectEditor_Children,Children,Hijo,,Children label in Object Editor
ObjectEditor_Circle,Circle,Circulo,,Object editor collision shape circle
ObjectEditor_CodeWindow,Code,Código,,object editor code window heading
ObjectEditor_CollisionShape,Collision Shape,Forma de colisión,,Object editor collision shape label
ObjectEditor_CurrentFrame,Current Frame,Fotograma actual,,Physics collision window current frame
ObjectEditor_DeleteEvent,Delete Event,Borrar evento,,Object Editor delete event menu option
ObjectEditor_DeleteEvents,Delete Events,Borrar eventos,,Object Editor delete event menu option (multiple)
ObjectEditor_CutEvent,Cut Event,Cortar evento,,Object editor cut event menu option
ObjectEditor_CopyEvent,Copy Event,Copiar evento,,Object editor copy event menu option
ObjectEditor_PasteEvent,Paste Event,Pegar evento,,Object editor paste event menu option
ObjectEditor_DuplicateEvent,Duplicate Event,Duplicar evento,,Object editor duplicate event menu option
ObjectEditor_SelectSprite,Select Sprite,Seleccionar sprite,,Object editor select sprite caption
ObjectEditor_SelectMask,Select Mask,Seleccionar máscara,,Object editor select mask caption
ObjectEditor_SelectParent,Select Parent,Seleccionar padre,,Object editor select parent caption
ObjectEditor_Event,Event,Evento,,Event button
ObjectEditor_Events,Events,Eventos,,object editor events heading
ObjectEditor_ModifyCollisionShape,Modify Collision Shape,Modificar forma de colisión,,"Object editor ""modify collision shape"" button label"
ObjectEditor_Name,Name:,Nombre:,,Name label in obejct editor
ObjectEditor_NewSprite,New,Nuevo,,object editor new sprite button
ObjectEditor_NoParent,No Parent,Sin padre,,"Object editor ""no parent"" setting"
ObjectEditor_NoSprite,No Sprite,Sin sprite,,"Object editor ""no sprite"" setting"
ObjectEditor_ObjectProperties,Object Properties,Propiedades de objeto,,Object properties window title
ObjectEditor_Physics,Physics,Físicas,,Physics label in Object Editor
ObjectEditor_PhysicsProperties,Physics Properties,Propiedades físicas,,Object editor physics properties label
ObjectEditor_PhysicsShape_WindowTitle,Physics Collision Shape,Forma de colisión física,,Object editor physics shape window title
ObjectEditor_Properties,Properties,Propiedades,,Object editor properties heading
ObjectEditor_SameMask,Same As Sprite,Igual que el Sprite,,"Object editor ""same as sprite"" mask setting"
ObjectEditor_MaskSameAsSprite,Same As Sprite,Igual que el Sprite,,Object editor same mask caption
ObjectEditor_Shape,Convex Shape,Forma convexa,,"Object editor collision shape ""shape"""
ObjectEditor_WindowTitle,Object: {0},Objeto: {0},,Object properties window title
OutputPanel_Output,Output,Salida,,Output panel output tab name
OutputPanel_SearchResults,Search Results,Resultados de búsqueda,,Output panel search results tab name
OutputPanel_SourceControl,Source Control,Control de código,,Output panel source control tab name
PathEditor_Add,Add,Añadir,,Path editor add button name
PathEditor_Closed,Closed,Cerrado,,Path editor closed path checkbox
PathEditor_ConnectionKind,Connection Kind,Connection Kind,,Connection kind radio group caption
PathEditor_ContextMenu_EditPoint,Edit,Editar,,Point label context menu item
PathEditor_EditPoint,Edit,Editar,,Edit button text on path editor
PathEditor_EditPoint_Cancel,Cancel,Cancelar,,Cancel button text
PathEditor_EditPoint_Save,Save,Guardar,,Save button text
PathEditor_EditPoint_Title,Edit Point {0} In {1},Edit Point {0} In {1},,Edit point dialog window caption
PathEditor_HorizontalShift,Horizontal Shift:,Horizontal Shift:,,Path shift dialog label
PathEditor_Insert,Insert,Insert,,Path editor insert button name
PathEditor_ListBoxItem_Speed,Speed:,Speed:,,The speed of a point in the path points collection
PathEditor_Name,Name:,Name:,,Path editor name textbox caption
PathEditor_Precision,Precision:,Precision:,,Path editor precision textbox caption
PathEditor_Remove,Remove,Eliminar,,Path editor remove button name
PathEditor_RoomPlugin_Inherit,Inherit,Heredar,,Path editor room editor plugin inherit button
PathEditor_RoomPlugin_NoPath,<No path>,<No path>,,Label when no path is being edited in path editor room plugin
PathEditor_RoomPlugin_SelectPath,Select Path...,Select Path...,,Select path property button for path editor room plugin
PathEditor_Shift,Shift,Mayús,,Path shift button text
PathEditor_ShiftDialog_Label,Click the arrow in the direction you want to shift the path.,Click the arrow in the direction you want to shift the path.,,Path editor shift dialog help text
PathEditor_ShiftPath_Title,Shift Path: {0},Shift Path: {0},,Path shift dialog title
PathEditor_SmoothCurve,Smooth Curve,Smooth Curve,,Path editor smooth curve connection kind
PathEditor_SnapX,Snap X,Snap X,,Path editor snap x label
PathEditor_SnapY,Snap Y,Snap Y,,Path editor snap y label
PathEditor_Speed,Speed,Speed,,Path editor speed textbox caption
PathEditor_SplineContextMenu_EditPoints,Edit Points,Edit Points,,Path spline editor context menu entry
PathEditor_SplineContextMenu_FlipHorizontalPath,Mirror,Mirror,,Path spline editor context menu entry
PathEditor_SplineContextMenu_FlipVerticalPath,Flip,Flip,,Path spline editor context menu entry
PathEditor_SplineContextMenu_PanToPath,Pan To Path,Pan To Path,,Path spline editor context menu entry
PathEditor_SplineContextMenu_Reverse,Reverse,Reverse,,Path spline editor context menu entry
PathEditor_SplineEditor_AddTip,Left Mouse Button: Add & Drag Anchor,Left Mouse Button: Add & Drag Anchor,,Path spline editor help tip
PathEditor_SplineEditor_Area,"Area: {0},{1} {2},{3}","Area: {0},{1} {2},{3}",,Path spline editor area location
PathEditor_SplineEditor_Cursor,"Cursor: {0},{1}","Cursor: {0},{1}",,Path spline editor cursor location
PathEditor_SplineEditor_EditTip,"T+LMB: Translate, R+LMB: Rotate, S+LMB: Scale","T+LMB: Translate, R+LMB: Rotate, S+LMB: Scale",,Path spline editor help tip
PathEditor_StraightLines,Straight Lines,Straight Lines,,Path editor straight lines connection kind
PathEditor_ToolTip_ShiftPath,Shift Path,Shift Path,,Path editor tool tip
PathEditor_ToolTip_SnapGrid,Snap Path To Grid,Snap Path To Grid,,Path editor tool tip
PathEditor_ToolTip_ToggleGrid,Toggle Grid On/Off,Toggle Grid On/Off,,Path editor tool tip
PathEditor_ToolTip_ZoomIn,Zoom In,Acercar,,Path editor tool tip
PathEditor_ToolTip_ZoomOut,Zoom Out,Alejar,,Path editor tool tip
PathEditor_ToolTip_ZoomReset,Reset Zoom,Restablecer Zoom,,Path editor tool tip
PathEditor_VerticalShift,Vertical Shift:,Cambio vertical:,,Path shift dialog label
PathEditor_WindowTitle,Path: {0},Ruta: {0},,Path editor window title
PathLayer_AddNewPath,<new path>,<new path>,,context menu entry for creating a new path within the path layer properties
PrefsTree_Title,Preferences,Preferencias,,Preferences tree title
DebugInfo_Title,Debug Info,Información depurar,,Debug info window title
DebugInfo_DumpMemory,Memory Usage,Uso de memoria,,Dump memory button label
OutputPanel_Title,Output,Salida,,Output panel window title
PropertyButton_NoGMObject,No Object,No Object,,no object selected caption for the view object button
PropertyButton_NoGMSprite,No Sprite,No Sprite,,Button caption for when no sprite is selected
PropertyButton_NoGMTileSet,No Tileset,No Tileset,,no background selected caption for the layer background button
ResourceNode_AddExisting,Add Existing,Añadir existente,,Resource Tree node menu - add an already existing resource
ResourceNode_AddExistingFromLibrary,Add Existing From My Library,Añadir existente de mi biblioteca,,Resource Tree node menu - open my library to select resource to import
ResourceNode_AddGroup,Add Group,Añadir grupo,,Add a group
ResourceNode_AddFromDefault,Add From Default View,Añadir de la vista predeterminada,,submenu heading to allow users to select a resource from the default view to add to their user view.
ResourceNode_RemoveFromView,Remove From Current View,Eleminar de la vista actual,,Resource Tree - remove a resource from the current view
ResourceNode_RemoveFromView_Confirm,"You are about to remove """"{0}"""" from view """"{1}"""". Continue?","Estás a punto de eliminar """"{0}"""" de la vista """"{1}"""". ¿Continuar?",,Resource Tree - confirmation of removal from the current view
ResourceNode_Create,Create,Crear,,Resource Tree node menu - create resource
ResourceNode_DndToScript,Convert to GML,Convertir a GML,,Resource Tree node menu - Dnd To GML
ResourceNode_ScriptToDnd,Convert to DnD™,Convertir a DnD™,,Resource Tree node menu - Script To Dnd
ResourceNode_CreateChild,Create Child,Crear hijo,,Resource tree context menu label for creating a child resource of the selected node
ResourceNode_CreateDataFile,Create Included File,Crear archivo incluido,,Resource Tree node menu - create included file
ResourceNode_Delete,Delete,Eliminar,,Resource Tree node menu - delete resource
ResourceNode_Duplicate,Duplicate,Duplicar,,Resource Tree node menu - duplicate
ResourceNode_ImportExtension,Import Extension,Importar extensión,,resource node menu - import extension
ResourceNode_InsertDataFile,Insert Included File,Insertar archivo incluido,,Resource Tree node menu - insert included file
ResourceNode_OpenExternally,Open Externally,Abrir externamente,,Resource Tree node menu - open externally
ResourceTree_ErrorOpeningExternally,Error Opening Externally,Error Opening Externally,,Resource Tree node menu - error open externally
ResourceNode_OpenInExplorer,Open In Explorer,${OpenInExplorer},,Resource Tree node menu - open in explorer
ResourceNode_OpenAll,Open All,Abrir todo,,Resource Tree node menu - open all
ResourceNode_OpenProperties,Open Properties,Abrir propiedades,,Resource Tree node menu - open properties
ResourceNode_OpenInMixer,Open In Sound Mixer,Open In Sound Mixer,,Resource Tree node menu - open in sound mixer
ResourceNode_OpenObjectEvents,Open All Event Scripts,Abrir todas las escrituras de evento,,Resource Tree node menu - open all event scripts
ResourceNode_Rename,Rename,Renombrar,,Resource Tree node menu - rename resource
ResourceTree_Configs,Configurations,Configuraciones,,
ResourceTree_DirectoryDelete_Confirm,"You are about to delete the directory ""{0}"" and all the items it contains. Continue?","Estas a punto de eliminar el directorio ""{0}"" y todo los artículos que contiene. ¿Continuar?",,Resource tree directory delete user confirmation
ResourceTree_Extensions,Extensions,Extensiones,,"Resource tree ""Extensions"" label"
ResourceTree_FileDelete_Confirm,"You are about to delete the file ""{0}"". Continue?","Estas a punto de eliminar el archivo ""{0}"". ¿Continuar?",,Resource tree file delete user confirmation 
ResourceTree_Fonts,Fonts,Fuentes,,"Resource tree ""Fonts"" label"
ResourceTree_IncludedFiles,Included Files,Archivos incluidos ,,"Resource tree ""Included Files"" label"
ResourceTree_NoResourceFound,No results found,No se han encontrado resultados,,message when nothing found when searching resource tree
ResourceMenu_CreateExtension,Create Extension,Crear extensión,,"Resource menu ""Create Extension"" entry"
ResourceMenu_CreateFont,Create Font,Crear fuente,,"Resource menu ""Create Font"" entry"
ResourceMenu_CreateIncludedFile,Create Included File,Crear archivo incluido,,"Resource menu ""Create Included File"" entry"
ResourceMenu_CreateObject,Create Object,Crear objeto,,"Resource menu ""Create Object"" entry"
ResourceMenu_CreatePath,Create Path,Crear ruta,,"Resource menu ""Create Path"" entry"
ResourceMenu_CreateRoom,Create Room,Crear habitación,,"Resource menu ""Create Room"" entry"
ResourceMenu_CreateScript,Create Script,Crear escritura,,"Resource menu ""Create Script"" entry"
ResourceMenu_CreateShader,Create Shader,Crear shader,,"Resource menu ""Create Shader"" entry"
ResourceMenu_CreateSound,Create Sound,Crear sonido,,"Resource menu ""Create Sound"" entry"
ResourceMenu_CreateSprite,Create Sprite,Crear sprite,,"Resource menu ""Create Sprite"" entry"
ResourceMenu_CreateTileset,Create Tile Set,Crear azulejos,,"Resource menu ""Create Tile Set"" entry"
ResourceMenu_CreateNote,Create Note,Crear nota,,"Resource menu ""Create Note"" entry"
ResourceMenu_CreateTimeline,Create Timeline,Crear cronograma,,"Resource menu ""Create Timeline"" entry"
ResourceMenu_Resources,Resources,Recursos,,Main resources menu entry
ResourceTree_MultipleResourceDelete_Confirm,Are you sure you want to delete these resources: {0}?,Are you sure you want to delete these resources: {0}?,,Resource tree delete confirmation label
ResourceTree_MultipleResourceDelete_IncludedFiles_Confirm,Are you sure you want to delete these resources: {0}?\nIncluded files/folders on disk will be deleted,Are you sure you want to delete these resources: {0}?\nIncluded files/folders on disk will be deleted,,Resource tree delete confirmation label
ResourceTree_MultipleResourceDelete_Events_Confirm,Are you sure you want to delete these resources: {0}?\nCollision events with deleted objects will also be deleted,Are you sure you want to delete these resources: {0}?\nCollision events with deleted objects will also be deleted,,Resource tree delete confirmation label
ResourceTree_Notes,Notes,Notas,,"Resource tree ""Notes"" label"
ResourceTree_Objects,Objects,Objetos,,"Resource tree ""Objects"" label"
ResourceTree_Options,Options,Opciones,,options
ResourceTree_Paths,Paths,Rutas,,"Resource tree ""Paths"" label"
ResourceTree_ResourceDelete_Confirm,Are you sure you want to delete {0}?,Seguro que quieres eliminar {0}?,,Resource tree delete confirmation label
ResourceTree_ResourceDelete_IncludedFiles_Confirm,Are you sure you want to delete {0}?\nIncluded files/folders on disk will be deleted,Are you sure you want to delete {0}?\nIncluded files/folders on disk will be deleted,,Resource tree folder delete confirmation label
ResourceTree_ResourceDelete_Events_Confirm,Are you sure you want to delete {0}?\nCollision events with deleted objects will also be deleted,Are you sure you want to delete {0}?\nCollision events with deleted objects will also be deleted,,Resource tree delete events confirmation label
ResourceTree_Rooms,Rooms,Habitaciones,,"Resource tree ""Rooms"" label"
ResourceTree_Scripts,Scripts,Escrituras,,"Resource tree ""Scripts"" label"
ResourceTree_Shaders,Shaders,Shaders,,"Resource tree ""Shaders"" label"
ResourceTree_Sounds,Sounds,Sonidos,,"Resource tree ""Sounds"" label"
ResourceTree_Sprites,Sprites,Sprites,,"Resource tree ""Sprites"" label"
ResourceTree_Tilesets,Tile Sets,Azulejos,,"Resource tree ""Tile Sets"" label"
ResourceTree_Timelines,Timelines,Cronogramas,,"Resource tree ""Timelines"" label"
ResourceTree_Title,Resources,Recursos,,Resource tree title
ResourceTree_ViewNameInUse,View Name Already In Use,Nombre de vista ya en uso,,label to show view name is already in use when renaming
ResourceTree_CannotRenameDefaultView,Cannot rename Default View,No se puede cambiar el nombre de la vista predeterminada,,label to show that you cannot rename default view
ResourceTree_LotsOfResourcesWarning,Do you want to open {0} resources for edit?,¿Quieres abrir {0} recursos para editar?,,label to warn user they are about to open a lot of resources
ResourceTree_LotsOfResourcesTitle,Opening Lots of Resources,Abriendo muchos recursos,,title for warning dialog box
ResourceTree_CloneViewToolTip,Clone current view,Clonar vista actual,,clone view tooltip
ResourceTree_AddViewToolTip,Add new view,Añadir nueva vista,,add new view tooltip
ResourceTree_DeleteViewToolTip,Delete current view,Eliminar vista actual,,delete view tooltip
ResourceTree_ExpandCollapseAllToolTip,Expand/Collapse All,Expandir/Colapsar todo,,expand/collapse all elements of the resource tree tooltip
ResourceTree_ExpandCollapseAll,Expand/Collapse All,Expandir/Colapsar todo,,expand/collapse all elements of the resource tree tooltip
ResourceTree_ExpandAll,Expand All,Expandir todo,,Expand all elements of the resource tree
ResourceTree_CollapseAll,Collapse All,Collapsar todo,,Collapse all elements of the resource tree
RoomEditor_AddSubLayer,Add Sub Layer,Añadir capa inferior,,context sub menu heading for adding sub layers in the room editor layer view
RoomEditor_AddRootLayer,Add Layer,Añadir capa,,context sub menu heading for adding layers at the same level as the selected layer in the room editor layer view
RoomEditor_AllLayers,All,Todo,,Layers label next to the set all layers locked/visible checkboxes
RoomEditor_ConfirmDeleteInstances,Are you sure you want to delete the following items (Note: Instance creation code will be irrevocably lost): {0},Are you sure you want to delete the following items (Note: Instance creation code will be irrevocably lost): {0},,Confirm delete instances
RoomEditor_ConfirmDeleteLayers,Are you sure you want to delete the following layers (Note: Instance creation code will be irrevocably lost): {0},Are you sure you want to delete the following layers (Note: Instance creation code will be irrevocably lost): {0},,Confirm delete layers
RoomEditor_ConfirmDeleteParentItems,Attempting to delete items from a parent room (Note: Instance creation code will be irrevocably lost).\nDelete All: Delete matching items from child rooms\nKeep All: Keep all child room items\nKeep Changed: Keep child room items which have overridden the parent\nImmediate Children: {0},Attempting to delete items from a parent room (Note: Instance creation code will be irrevocably lost).\nDelete All: Delete matching items from child rooms\nKeep All: Keep all child room items\nKeep Changed: Keep child room items which have overridden the parent\nImmediate Children: {0},,layer delete confirm dialog message explaining the child layer deletion options
